{"schema_version":1,"source_kind":"nvapi_thermal_channel","gpu_index":0,"gpu_uuid":"GPU-11111111-2222-3333-4444-555555555555","captured_at_utc":"2026-09-05T20:47:28.8430000\u002B00:00","captured_at_unix_ms":1788641248843,"monotonic_ns":36930612143800,"monotonic_frequency_hz":10000000,"gpu_die_temperature_c":35.094,"gpu_hotspot_temperature_c":45.281,"delta_c":10.187,"native_status":0,"profile_evidence_stage":"matched_external_reference","profile_name":"rtx3060-2504-1536-vbios-94.06.25.00.fc-driver-610.88","interface_id":"0x65fe3aad","structure_version":"0x000200a8","nvapi_module_sha256":"df6455ccf83e43cfe68f405af1eec4e053c7f95da998bf358053b7583980c2f4","function_rva":"0x001e0bc0"}
